{
  "version": "1.0",
  "plugin": "public-equity-investing",
  "routing_policy": {
    "invocation_policy_reference": "shared/invocation-policy.md",
    "playbook_reference": "shared/plugin-routing-playbook.md",
    "default_routing_principle": "Route broad prompts by listed-equity investor workflow before choosing an individual skill. Pick one lead skill that owns the first real investment judgment or hero artifact, then call support skills only for the workstreams the lead skill assigns.",
    "artifact_hierarchy": "Hero human deliverable first, companion workbook/report artifacts second, support JSON/CSV/Markdown/log/manifest files last.",
    "support_artifact_policy": "Support outputs preserve evidence, source ids, assumptions, and validation status, but do not become the primary user-facing artifact unless the user explicitly asks for machine-readable output.",
    "negative_boundary": "Do not activate on private-company diligence, credit-first analysis, personal financial advice, generic company summaries, or generic model/deck/report/document requests with no public-equity investment context. Corporate finance work, investment banking transaction execution, private markets diligence, and credit-security research remain outside scope unless the actual user task is a listed-equity investor workflow.",
    "non_trigger_examples": [
      "Why did this stock move today?",
      "Summarize this company's earnings.",
      "Build a valuation model for this business.",
      "Make a generic report about this public company.",
      "Prepare a meeting brief.",
      "Clean this spreadsheet.",
      "Draft a board deck.",
      "Analyze the company's creditworthiness."
    ]
  },
  "workflows": [
    {
      "workflow_id": "company_tearsheet",
      "workflow_name": "Company tearsheet",
      "investor_intent": "Build a cited baseline profile for a listed issuer, public-company peer, or public-sector comparable before deeper equity work.",
      "typical_user_prompts": [
        "Build a public-company tearsheet for ACME before we decide whether to do more work.",
        "Create a cited profile of this listed issuer and its public peers."
      ],
      "lead_skill": "company-tearsheet",
      "supporting_skills": [
        "financial-source-of-truth",
        "sector-context-overlay",
        "dashboard-builder"
      ],
      "default_artifact_mode": "html_report",
      "hero_deliverable": "Cited company tearsheet HTML report or concise chat profile for narrow requests.",
      "companion_deliverables": [
        "source_register.csv",
        "peer_metric_support.csv"
      ],
      "support_artifacts": [
        "support/source_index.csv",
        "logs/source_posture.json"
      ],
      "source_gates": [
        "Verify issuer identity, ticker, exchange, fiscal calendar, and as-of date before citing market or financial facts.",
        "Label unavailable market data, stale filings, and unsupported estimates instead of filling gaps."
      ],
      "quality_gates": [
        "Do not imply a rating, target price, sizing view, or trade action unless the user asked for investment judgment and the route escalates to the owning workflow.",
        "Keep company profile facts separate from PM judgment and assumptions."
      ],
      "routing_triggers": [
        "public-company tearsheet",
        "listed issuer profile",
        "public issuer profile",
        "public peer profile",
        "company snapshot for a PM",
        "ticker profile"
      ],
      "do_not_route_when": [
        "The user asks for transaction, sale process, CIM, buyer list, or banker materials.",
        "The user asks for creditworthiness, covenant, bond, loan, CDS, or distressed-debt analysis."
      ],
      "escalation_paths": [
        {"to": "Investment Banking", "when": "The request is a banker transaction profile, buyer-facing material, or deal-process artifact."},
        {"to": "Credit Markets", "when": "The request is credit-security research or creditworthiness rather than common-equity context."}
      ],
      "clarifying_questions": [
        "Is the profile for a PM screen, initiation, earnings prep, pitch, or meeting brief?"
      ],
      "stop_or_escalate_when": [
        "Issuer identity or ticker cannot be resolved with enough confidence to support a public-equity artifact."
      ]
    },
    {
      "workflow_id": "initiating_coverage",
      "workflow_name": "Initiating coverage",
      "investor_intent": "Create a full public-equity initiation report with thesis, valuation, catalysts, risks, estimates, and target-price support.",
      "typical_user_prompts": [
        "Initiate coverage on this public company with a full investment view.",
        "Build an initiation report with thesis, valuation, catalysts, and risk/reward."
      ],
      "lead_skill": "initiating-coverage",
      "supporting_skills": [
        "company-tearsheet",
        "comps-valuation",
        "dcf-model-builder",
        "three-statement-model-builder",
        "scenario-sensitivity-generator",
        "catalyst-calendar",
        "financial-source-of-truth",
        "sector-context-overlay",
        "deck-report-qc"
      ],
      "default_artifact_mode": "html_report",
      "hero_deliverable": "Polished standalone HTML initiation report with source ledger and investment conclusion.",
      "companion_deliverables": [
        "valuation_workbook.xlsx",
        "scenario_support.xlsx",
        "catalyst_calendar.html"
      ],
      "support_artifacts": [
        "support/source_register.csv",
        "support/model_citations.json",
        "logs/readiness_manifest.json"
      ],
      "source_gates": [
        "Verify current price, share count, financial history, estimates, and valuation as-of dates before stating a target or rating.",
        "Separate confirmed facts, model assumptions, variant perception, and missing evidence."
      ],
      "quality_gates": [
        "Do not publish a target price, rating, or action without visible source/model support and risk/reward logic.",
        "Show what proves, kills, or changes the thesis."
      ],
      "routing_triggers": [
        "initiate coverage",
        "initiating coverage",
        "full initiation report",
        "target price",
        "rating initiation",
        "full public-equity investment report"
      ],
      "do_not_route_when": [
        "The user only wants a quick company profile or single metric lookup.",
        "The request is sell-side banking or client transaction coverage."
      ],
      "escalation_paths": [
        {"to": "Investment Banking", "when": "The output is a banker pitch, transaction deck, or issuer advisory package."},
        {"to": "Credit Markets", "when": "The investment view is on bonds, loans, CDS, distressed debt, or credit spread instruments."}
      ],
      "clarifying_questions": [
        "Is the intended audience long-only PM, long/short fund, sell-side research, or internal IC?"
      ],
      "stop_or_escalate_when": [
        "Market data, estimates, or valuation inputs are too stale or unsupported for an initiation-level conclusion."
      ]
    },
    {
      "workflow_id": "earnings_preview",
      "workflow_name": "Earnings preview",
      "investor_intent": "Prepare a pre-print equity view before reported results, centered on the expectation bar, likely reaction drivers, scenarios, and call questions.",
      "typical_user_prompts": [
        "Build a pre-earnings preview for this stock.",
        "Prepare the expectation bar, scenarios, and call questions before ACME reports."
      ],
      "lead_skill": "earnings-preview",
      "supporting_skills": [
        "company-tearsheet",
        "financial-source-of-truth",
        "sector-context-overlay",
        "scenario-sensitivity-generator",
        "portfolio-risk-management",
        "dashboard-builder"
      ],
      "default_artifact_mode": "html_report",
      "hero_deliverable": "Polished standalone HTML pre-earnings report.",
      "companion_deliverables": [
        "earnings_scenario_support.xlsx",
        "call_question_list.md"
      ],
      "support_artifacts": [
        "support/kpi_history.csv",
        "support/source_register.csv",
        "logs/earnings_preview_manifest.json"
      ],
      "source_gates": [
        "Verify event date, reporting period, current price, consensus, company guide, and relevant KPI history before framing the setup.",
        "Label stale or unavailable consensus and market data rather than treating them as current."
      ],
      "quality_gates": [
        "Every scenario must state what would move the stock, not only whether results beat or miss.",
        "Call questions should map to thesis variables, not generic management prompts."
      ],
      "routing_triggers": [
        "earnings preview",
        "pre-earnings",
        "pre print",
        "pre-print",
        "expectation bar",
        "earnings setup",
        "call questions before earnings",
        "quarter preview"
      ],
      "do_not_route_when": [
        "Results have already been released and the user asks for the post-print read.",
        "The user only asks for a generic earnings summary with no investment mandate."
      ],
      "escalation_paths": [
        {"to": "Corporate Finance", "when": "The request is internal company forecasting or budget variance, not public-equity investment work."},
        {"to": "Credit Markets", "when": "The earnings question is for credit-security or spread impact analysis."}
      ],
      "clarifying_questions": [
        "What audience and depth should control: quick PM setup, full report, or model-update package?"
      ],
      "stop_or_escalate_when": [
        "The event date, period, or consensus baseline cannot be established."
      ]
    },
    {
      "workflow_id": "earnings_deep_dive",
      "workflow_name": "Earnings deep dive",